{
  "$schema": "../schemas/test-case.schema.json",
  "id": "basic-call-identity",
  "description": "M1 as data: a basic call with authored From/To/R-URI; the SUT must preserve the caller identity end-to-end to bob1's initial INVITE.",
  "compatibleShapes": [
    "basic-call"
  ],
  "input": {
    "core": {
      "from": "sip:+15551234567@example.com",
      "to": "sip:+15559876543@example.com",
      "ruri": "sip:+15559876543@127.0.0.1:5070"
    }
  },
  "checkSets": [
    "invite-identity"
  ],
  "checks": [
    {
      "on": "bob1.initialInvite",
      "optional": false,
      "checks": [
        {
          "field": "from.userInfo",
          "op": "regex",
          "value": "^\\+15551234567$"
        },
        {
          "field": "to.userInfo",
          "op": "regex",
          "value": "^\\+15559876543$"
        },
        {
          "field": "body",
          "op": "regex",
          "value": "m=audio"
        }
      ]
    }
  ]
}
