{
  "$schema": "../schemas/test-case.schema.json",
  "id": "rerouting-prack-identity",
  "description": "Rerouting plus a reliable provisional on the winning leg: bob2 answers 183 Require:100rel/RSeq, alice PRACKs, then the call completes. The reliability markers must survive the SUT relay.",
  "compatibleShapes": [
    "rerouting_prack"
  ],
  "input": {
    "core": {
      "from": "sip:+15551234567@example.com",
      "to": "sip:+15559876543@example.com",
      "ruri": "sip:+15559876543@127.0.0.1:5070"
    }
  },
  "checkSets": [
    "invite-identity"
  ],
  "checks": [
    {
      "on": "alice.firstProvisional",
      "optional": false,
      "checks": [
        {
          "field": "header(Require)",
          "op": "regex",
          "value": "100rel"
        },
        {
          "field": "header(RSeq)",
          "op": "exists"
        }
      ]
    },
    {
      "on": "bob2.prack",
      "optional": false,
      "checks": [
        {
          "field": "header(RAck)",
          "op": "exists"
        },
        {
          "field": "from.uri",
          "op": "eq",
          "value": "${input.from}"
        }
      ]
    },
    {
      "on": "bob2.initialInvite",
      "optional": false,
      "checks": [
        {
          "field": "from.userInfo",
          "op": "regex",
          "value": "^\\+15551234567$"
        }
      ]
    }
  ]
}
